{
    "$schema": "http://json-schema.org/draft-04/schema#",
    "description": "An intersection of two B\\u00e9zier surfaces.",
    "type": "object",
    "properties": {
        "surface1": {
            "description": "ID of the first surface in the intersection.",
            "type": "string"
        },
        "surface2": {
            "description": "ID of the second surface in the intersection.",
            "type": "string"
        },
        "id": {
            "description": "ID of intersection ``test case''.",
            "type": "integer"
        },
        "note": {
            "description": "Description of the intersection(s).",
            "type": "string"
        },
        "intersections": {
            "description": "List of info describing curved polygon(s) in the intersection.",
            "type": "array",
            "items": {
                "description": "Either a curved polygon that occurs within the surface-surface intersection or a boolean. If a boolean, `true` indicates that the intersection is the first surface (i.e. it's fully contained in the second) and `false` indicates that the intersection is the second surface.",
                "oneOf": [
                    {"type": "boolean"},
                    {"$ref": "./curved_polygon.json"}
                ]
            }
        }
    },
    "additionalProperties": false,
    "required": [
        "surface1",
        "surface2",
        "id",
        "intersections"
    ]
}
